title,genre,rating,status,episodes,release year,description
Trò Chơi Sống Còn,"['Hành động', 'Phiêu lưu', 'Viễn tưởng', 'CN Animation']","['6.8', '73']",Hoàn thành,16,2023,"Để không bị bắt làm nô lệ,Kiều Kinh Đình, người vô tình bước vào trò chơi vực thẳm, đã thành lập liên minh với Thư Ngải một game thủ cũ mang trong mình lòng hận thù, và Bạch Nhĩ, một thiếu niên với quá khứ bí ẩn. Họ cùng nhau đối mặt với sự ác độc của Hàn Bân, kẻ thống trị tàn ác, và tổ chức của anh ta. Sau những cuộc chiến khốc liệt, khi họ tự tin rằng chiến thắng đã đến gần, họ phát hiện ra mình bị rơi vào bẫy của Hàn Bân, lâm vào tình cảnh tuyệt vọng. Điều đáng sợ hơn là, với thất bại này, sự tin tưởng duy nhất giữa ba người cũng tan vỡ hoàn toàn. Trong thời khắc nguy cấp, sự xuất hiện của một cao thủ siêu phàm, Châu Nhất Đao, thay đổi cả cục diện lực lượng tại làng mới và mang đến cho Kiều Kinh Đình và những người khác một tia hy vọng trốn thoát."
Dr. Stone: New World,"['Anime', 'Hành động', 'Hài hước', 'Viễn tưởng']","['9.5', '584']",Hoàn thành,22,2023,Phần thứ 3 của Dr. Stone diễn ra sau movie Ryuusui
Boushoku no Berserk,"['Anime', 'Hành động', 'Viễn tưởng']","['8.6', '374']",Hoàn thành,12,2023,"Tại một thế giới nơi tính ưu việt của kỹ năng quyết định tất cả thì Fate, một người gác cổng, lại chỉ có một kỹ năng duy nhất là """"phàm ăn"""". Do kỹ năng đó chỉ khiến cho cậu cậu cảm thấy đói, nên cậu bị buộc phải sống một cuộc sống đê hèn thấp kém. Tuy nhiên, một ngày nọ, Fate tiêu diệt được một tên cướp đột nhập vào thành, và tất cả mọi thứ đã thay đổi. Chàng trai từng bị cho là kém cỏi và vô năng sẽ bắt đầu cuộc hành trình vươn đến đỉnh cao của thế giới."
My Daemon,"['Anime', 'Hành động', 'Phiêu lưu', 'Viễn tưởng']","['9.2', '73']",Hoàn thành,13,2023,N/A
AI no Idenshi,"['Anime', 'Shounen', 'Drama', 'Viễn tưởng']","['7.3', '41']",Hoàn thành,12,2023,"Thế giới mang tính công nghệ cao, ước mơ của con người, kết tinh của công nghệ - robot hình người, Họ hòa nhập hoàn toàn vào cuộc sống con người, nhưng cũng làm nảy sinh những mâu thuẫn mới... Tương tự như con người, chúng cũng có thể ""ốm"" và có những cách ""điều trị"" khác với con người... Gần gũi với những AI đầy rắc rối này, câu chuyện về bác sĩ kiểu mới Sudo bắt đầu từ đây!"
Thiếu Nữ Điện Khí,"['Hài hước', 'Viễn tưởng', 'CN Animation']","['NaN', '9']",Hoàn thành,12,2023,N/A
Khóa Chặt Cửa Nào Suzume,"['Anime', 'Tình cảm', 'Siêu nhiên', 'Phiêu lưu', 'Viễn tưởng']","['9.6', '221']",Hoàn thành,1,2023,"Khóa Chặt Cửa Nào Suzume Suzume 2023 Full HD Vietsub Thuyết Minh Cuộc hành trình của Suzume 17 tuổi bắt đầu tại một thị trấn yên tĩnh ở Kyushu khi cô gặp một chàng trai trẻ nói với cô rằng: ""Tôi đang tìm một cánh cửa."" Những gì Suzume tìm thấy là một cánh cửa phong hóa duy nhất đứng thẳng giữa đống đổ nát như thể nó được che chắn khỏi bất kỳ thảm họa nào xảy ra. Dường như bị thu hút bởi sức mạnh của nó, Suzume với tay nắm lấy... Những cánh cửa lần lượt mở ra trên khắp Nhật Bản, gây ra sự hủy diệt cho bất kỳ ai ở gần. Suzume phải đóng những cổng này để ngăn thảm họa tiếp theo. Các ngôi sao. Hoàng hôn. Bầu trời buổi sáng. Trong vương quốc đó, dường như tất cả thời gian đều tan chảy trên bầu trời—được dẫn dắt bởi những cánh cửa bí ẩn này, hành trình đóng những cánh cửa của Suzume sắp bắt đầu."
Nghịch Thiên Chí Tôn,"['CN Animation', 'Tiên hiệp', 'Trùng sinh']","['7.5', '584']",Đang tiến hành,345,2021,PHIM ĐƯỢC CẬP NHẬT MỖI THỨ 2 VÀ THỨ 6 HÀNG TUẦN
Vô Thượng Thần Đế,"['CN Animation', 'Tiên hiệp', 'Trùng sinh', 'Huyền ảo']","['8.0', '749']",Đang tiến hành,423,2020,PHIM ĐƯỢC CẬP NHẬT MỖI THỨ 2 VÀ THỨ 6 HÀNG TUẦN
Độc Bộ Tiêu Dao,"['CN Animation', 'Kiếm hiệp', 'Huyền ảo', 'Xuyên không', 'Trùng sinh']","['7.4', '664']",Đang tiến hành,456,2020,PHIM ĐƯỢC CẬP NHẬT MỖI THỨ 2 VÀ THỨ 5 HÀNG TUẦN
Tiên Nghịch,"['CN Animation', 'Tiên hiệp', 'Huyền ảo']","['9.3', '1243']",Đang tiến hành,56,2023,Lịch chính thức: 1 TẬP MỖI TRƯA THỨ 2 HÀNG TUẦN
Tiên Võ Truyện,"['CN Animation', 'Tiên hiệp', 'Huyền ảo']","['8.4', '436']",Đang tiến hành,81,2023,PHIM ĐƯỢC CẬP NHẬT 1 TẬP MỖI CHỦ NHẬT HÀNG TUẦN
Võ Thần Chúa Tể,"['CN Animation', 'Tiên hiệp', 'Xuyên không', 'Trùng sinh', 'Huyền ảo']","['8.5', '1121']",Đang tiến hành,481,2020,PHIM ĐƯỢC CẬP NHẬT MỖI TRƯA THỨ 3 VÀ CHỦ NHẬT HÀNG TUẦN
Linh Kiếm Tôn,"['CN Animation', 'Trùng sinh', 'Huyền ảo']","['7.5', '929']",Đang tiến hành,526,2019, 
Đấu Phá Thương Khung Phần 5,"['CN Animation', 'Huyền ảo']","['9.0', '2463']",Đang tiến hành,114,2022,Lịch chính thức: 1 TẬP MỖI TRƯA CHỦ NHẬT HÀNG TUẦN
Vạn Giới Độc Tôn,"['CN Animation', 'Kiếm hiệp', 'Huyền ảo', 'Dị giới']","['8.1', '554']",Đang tiến hành,273,2021,PHIM ĐƯỢC CẬP NHẬT MỖI THỨ 3 VÀ THỨ 7 HÀNG TUẦN
Luyện Khí Mười Vạn Năm,"['CN Animation', 'Tiên hiệp', 'Huyền ảo']","['8.5', '702']",Đang tiến hành,170,2023,PHIM ĐƯỢC CẬP NHẬT MỖI THỨ 3 VÀ THỨ 7 HÀNG TUẦN
Thần Võ Thiên Tôn,"['CN Animation', 'Tiên hiệp', 'Xuyên không', 'Huyền ảo']","['6.6', '77']",Đang tiến hành,12,2024,PHIM ĐƯỢC CẬP NHẬT 1 TẬP MỖI THỨ 7 HÀNG TUẦN
Phàm Nhân Tu Tiên,"['CN Animation', 'Tiên hiệp', 'Huyền ảo']","['9.4', '1996']",Đang tiến hành,121,2020,PHIM ĐƯỢC CẬP NHẬT 1 TẬP MỖI TRƯA THỨ 7 HÀNG TUẦN
Thần Mộ,"['CN Animation', 'Tiên hiệp', 'Trùng sinh', 'Huyền ảo']","['9.2', '553']",Hoàn thành,26,2022,PHIM ĐƯỢC CẬP NHẬT 1 TẬP MỖI TRƯA THỨ 7 HÀNG TUẦN
Ở Rể Phần 2,['CN Animation'],"['NaN', '9']",Đang tiến hành,10,2023,"Doãn Ninh đến Vũ triều và trở thành Ninh Nghị, con rể của một nhà thương nhân với địa vị thấp bé. Tô Đàn Nhi thê tử của anh buôn bán vải, bận rộn không để ý tới anh. Từ đây Ninh Nghị bị cuốn vào thương trường đầy khó khăn, với tính cách kiên trí và tài năng kinh doanh của mình anh đã phát triển cơ nghiệp trong các cuộc tranh đấu mà anh ta phải đối mặt, Cuộc chiến kinh doanh và thay đổi số phận của anh sẽ ra sao?"
Đấu La Đại Lục 2 Tuyệt Thế Đường Môn,"['CN Animation', 'Huyền ảo', 'Dị giới']","['7.6', '727']",Đang tiến hành,68,2023,Lịch chính thức: 1 TẬP MỖI TRƯA THỨ 7 HÀNG TUẦN
Bách Luyện Thành Thần,"['CN Animation', 'Kiếm hiệp', 'Huyền ảo', 'Dị giới']","['8.4', '649']",Đang tiến hành,96,2022,PHIM ĐƯỢC CẬP NHẬT 1 TẬP MỖI THỨ 6 HÀNG TUẦN
Vĩnh Sinh ,"['CN Animation', 'Tiên hiệp', 'Huyền ảo', 'Võ hiệp']","['9.1', '623']",Đang tiến hành,54,2022,PHIM ĐƯỢC CẬP NHẬT 1 TẬP MỖI TRƯA THỨ 6 HÀNG TUẦN
Thế Giới Hoàn Mỹ,"['CN Animation', 'Tiên hiệp', 'Kiếm hiệp', 'Huyền ảo']","['9.2', '2529']",Đang tiến hành,182,2021,Lịch chính thức: 1 TẬP MỖI TRƯA THỨ 6 HÀNG TUẦN
Sư Huynh À Sư Huynh,"['CN Animation', 'Kiếm hiệp', 'Huyền ảo', '[CNA] Hài hước']","['9.4', '780']",Đang tiến hành,56,2023, 
Thần Ấn Vương Tọa,"['CN Animation', 'Huyền ảo', 'Dị giới']","['8.8', '1592']",Đang tiến hành,126,2022,PHIM ĐƯỢC CẬP NHẬT 1 TẬP MỖI TRƯA THỨ 5 HÀNG TUẦN
Kiếm Lai,"['CN Animation', 'Tiên hiệp', 'Huyền ảo']","['9.4', '427']",Đang tiến hành,9,2024,PHIM ĐƯỢC CẬP NHẬT 1 TẬP MỖI TRƯA THỨ 5 HÀNG TUẦN
Thiếu Niên Bạch Mã Túy Xuân Phong Phần 2,"['CN Animation', 'Kiếm hiệp']","['NaN', '7']",Đang tiến hành,12,2024,Đang update...
Trảm Thần,['CN Animation'],"['9.4', '275']",Đang tiến hành,10,2024,"Câu chuyện diễn ra trong thời mạt thế nguy hiểm trùng trùng, kể về thiếu niên Lâm Thất Dạ sau khi trở thành người đại diện cho thần minh đã dựa vào sự cố gắng và giác ngộ của mình để trở thành người gác đêm cho đô thị, thành người bảo vệ quê hương, giữ yên đất nước."
Nhất Niệm Vĩnh Hằng,"['CN Animation', 'Tiên hiệp', 'Huyền ảo']","['9.0', '2270']",Đang tiến hành,124,2020,Lịch chính: 1 TẬP MỖI TRƯA THỨ 4 HÀNG TUẦN
Già Thiên,"['CN Animation', 'Tiên hiệp', 'Xuyên không', 'Huyền ảo']","['8.6', '1358']",Đang tiến hành,76,2023,Lịch chính thức: 1 TẬP MỖI TRƯA THỨ 4 HÀNG TUẦN
Thôn Phệ Tinh Không,"['CN Animation', 'Huyền ảo', 'Khoa huyễn']","['9.7', '4521']",Đang tiến hành,138,2021, 
 Thiếu Niên Bạch Mã Túy Xuân Phong,['CN Animation'],"['NaN', '2']",Hoàn thành,20,2023,"Câu chuyện xảy ra vào 20 năm trước câu chuyện của 《 Thiếu Niên Ca Hành 》, Bách Lý Đông Quân người sau này trở thành thiên hạ đệ nhất khi đó vẫn là cháu đích tôn với muôn vàn sủng ái trong Trấn Tây Hầu phủ. Tuy rằng có một phụ thân võ công tuyệt thế cùng mẫu thân là con gái gia chủ Ôn gia, nhưng lại không chăm chỉ tập võ, đặc biệt thích ủ rượu. Sau 10 năm liền có thể ủ ra loại rượu tuyệt phẩm, cuối cùng lấy cắp trong nhà một tờ khế đất, chạy ra vài trăm dặm tới Sài Tang thành mở tửu quán. Nhưng cả một con phố dài đầy sát tinh. Chỉ có hắn, mới thật sự là tiểu thiếu niên nghiêm túc ủ rượu. Cũng bởi vậy mà bị cuốn vào trong phân tranh giữa hai đại gia tộc, trên đường tình cờ làm quen kết giao với lãng khách lang thang giang hồ Tư Không Trường Phong cùng Chước Mặc công tử Lôi Mộng Sát từ Thiên Khải thành chạy đến, bởi vì cảm kích ân cứu mạng của đối phương, hắn quyết định trợ giúp…"
Thế Giới Hoàn Mỹ OVA Hỏa chi Hôi Tẫn,"['CN Animation', 'Tiên hiệp', 'Huyền ảo']","['9.3', '76']",Hoàn thành,3,2024,Hỏa Linh Nhi - Đế Hậu của lòng ta!!
Toàn Chức Pháp Sư OVA Lời uỷ thác thần bí,"['CN Animation', 'Huyền ảo', 'Dị giới']","['9.2', '33']",Hoàn thành,6,2024,"""Toàn chức pháp sư phần đặc biệt: Lời uỷ thác thần bí"" được chuyển thể từ chương Hồng Thú của bộ truyện ""Toàn chức pháp sư"". Phần này kể về câu chuyện của nam chính Mạc Phàm và đồng đội Lãnh Linh Linh bị cuốn vào một vụ án lâu năm chưa có lời giải sau khi nhận được lời mời của vua săn bắn thần bí. Trải qua quá trình thăm dò và điều tra, họ phát hiện ra rằng tất cả những điều này là âm mưu do Hồng Thú lên kế hoạch. Bằng cách ký sinh vào cơ thể của những ma đầu như Nhất Thu và Lục Côn, nó đã trưởng thành từng bước và dần tiếp cận gần hơn tới mục tiêu cuối cùng của nó. Sau trận chiến sinh tử cam go, Mạc Phàm đã tiêu diệt được Hồng Thú dưới sự hỗ trợ của Linh Linh, Vọng Nguyệt Thiên Huân và những người bạn khác. Nhưng rồi, anh phát hiện ra đó chỉ là một trong những bản sao của nó, còn mình đã trở thành một phần trong âm mưu của Hồng Thú từ bao giờ..."
Nguyên Tôn,"['Huyền ảo', 'CN Animation', 'Tiên hiệp']","['9.0', '201']",Hoàn thành,26,2024,"Nhân vật chính là hoàng tử Chu Nguyên, nguyên bản có được Thánh Long chi mệnh, lại bị địch quốc Võ Vương lấy ức vạn Đại Chu con dân làm uy hiếp, mãng tước nuốt rồng, cướp đi nó Thánh Long khí vận. Chu Nguyên nhập tổ địa, gặp Yêu Yêu; mở lại tám mạch, lại đạp hành trình. Thiếu niên chấp bút, Long Xà vũ động; bổ ra loạn thế, thắp sáng thương khung"
Tru Tiên,"['CN Animation', 'Tiên hiệp', 'Kiếm hiệp', 'Huyền ảo']","['8.9', '1090']",Đang tiến hành,52,2022,Lịch chính thức: 1 TẬP MỖI TRƯA THỨ 7 HÀNG TUẦN
Quyến Tư Lượng,"['CN Animation', 'Tiên hiệp', 'Huyền ảo']","['9.1', '390']",Hoàn thành,32,2021,PHIM ĐƯỢC CẬP NHẬT 1 TẬP MỖI TRƯA THỨ 4 HÀNG TUẦN
Nhất Thế Chi Tôn,"['CN Animation', 'Tiên hiệp', 'Huyền ảo']","['5.5', '37']",Đang tiến hành,16,2024,N/A
Đại Chúa Tể,"['CN Animation', 'Tiên hiệp', 'Huyền ảo', 'Dị giới']","['8.5', '437']",Đang tiến hành,52,2023,Lịch phát sóng: trưa thứ 6 ngày 30/6/2023
Định Hải Phù Sinh Lục,"['CN Animation', 'Tiên hiệp', 'Kiếm hiệp', 'Huyền ảo']","['5.1', '22']",Hoàn thành,12,2021,N/A
Thập Phương Võ Thánh,"['Hành động', 'CN Animation', 'Tiên hiệp', 'Kiếm hiệp', 'Huyền ảo']","['7.3', '61']",Hoàn thành,16,2023,"Vào năm thứ ba dưới triều đại của Hoàng đế Shizong, thế giới hỗn loạn và người dân rất khó kiếm sống. Chính quyền hoàng gia trung ương sụp đổ, gây ra sự phân chia các khu vực và thành lập các nhóm quyền lực độc lập. Các giáo phái và nhóm ma quỷ hoạt động bí mật và các băng nhóm khác nhau chiến đấu với nhau. Ngoài ra, thiên tai liên tục xảy ra, người dân phải đấu tranh vì hy vọng và sự cứu rỗi. Nhiều giáo phái và trường phái khác nhau đã được thành lập và họ đấu tranh để giành lấy tài nguyên, lãnh thổ cũng như thiết lập các quy tắc của riêng mình. Những người có tham vọng cố gắng kiểm soát toàn bộ thế giới và thành lập một triều đại của riêng mình. Cũng có những người chân chính cố gắng cứu độ người dân. Wei He có một viên ngọc trai có thể đột phá các cõi khác nhau và giúp anh ta du hành qua thế giới hỗn loạn và từng bước tạo ra huyền thoại của riêng mình."
Võ Ánh Tam Thiên Đạo,"['Tiên hiệp', 'Huyền ảo', 'CN Animation']","['8.6', '299']",Hoàn thành,60,2022,"Thiên hạ 3 vạn châu, cộng tôn triều ca, nhưng chư hầu mọc như rừng, tông phái khắp nơi, ai nấy cũng có tâm tư. Hứa Vô Chu, con rể của Tần gia thành Lân An bất ngờ lấy được bảo khí ""chén Luân Hồi"" không ngờ thôn phệ kim loại, tự thân lớn mạnh, cũng âm thầm giúp Tần gia vượt qua khó khăn, cứu vãn hình ấn tượng xấu của mình ở Tần gia. "
Luyện Khí Luyện Đến 3000 Năm,"['CN Animation', 'Tiên hiệp', 'Xuyên không', 'Trùng sinh', 'Huyền ảo', '[CNA] Hài hước']","['5.3', '45']",Hoàn thành,16,2023,N/A
Ngạo Thế Cửu Trùng Thiên,"['Hành động', 'Phiêu lưu', 'CN Animation', 'Tiên hiệp', 'Kiếm hiệp']","['7.6', '109']",Đang tiến hành,12,2023,PHIM ĐƯỢC CẬP NHẬT 1 TẬP MỖI CHỦ NHẬT HÀNG TUẦN
Vũ Động Càn Khôn,"['Tiên hiệp', 'CN Animation', 'Kiếm hiệp', 'Huyền ảo']","['9.4', '1360']",Đang tiến hành,54,2019,Main: Võ Tổ - Lâm Động
Tu La Võ Thần,"['Hành động', 'CN Animation', 'Tiên hiệp']","['9.2', '263']",Hoàn thành,16,2023,"Được chuyển thể từ tiểu thuyết cùng tên. Phim kể về một thiếu niên bị gia tộc ức hiếp, từ một đệ tử ngoại môn bình thường của môn phái hạng hai Thanh Long tông, tình cờ có được sức mạnh của thần lôi cửu sắc và phát hiện ra một sức mạnh to lớn hơn bị phong ấn trong cơ thể. Qua không ngừng tu luyện và trưởng thành, đồng thời kết giao với những người bạn đồng hành như Tô Mỹ, Tô Nhu,... Sức mạnh của Sở Phong liên tục tăng lên..."
Chân Dương Võ Thần,"['CN Animation', 'Tiên hiệp', 'Huyền ảo']","['6.4', '124']",Đang tiến hành,14,2023,PHIM ĐƯỢC CẬP NHẬT 1 TẬP MỖI TRƯA THỨ 2 HÀNG TUẦN
Thiên Quan Tứ Phúc,"['CN Animation', 'Tiên hiệp', 'Huyền ảo']","['7.2', '59']",Hoàn thành,12,2020,"Thái Tử ba lần phi tiên đều thất bại bèn bị giáng chức, trong quá trình tu luyện ở nhân gian, đã quen một thiếu niên mặc áo đỏ thần bí và hai vị quan Tiểu thần. Bốn người cùng nhau giải quyết từng chuyện kỳ lạ, đồng thời dần dần tiếp xúc với các bí mật bất ngờ được Chúng Thần Quan che dấu."
Bách Luyện Phi Thăng Lục,"['CN Animation', 'Tiên hiệp', 'Huyền ảo']","['6.0', '121']",Đang tiến hành,57,2023,PHIM ĐƯỢC CẬP NHẬT MỖI THỨ 3 VÀ THỨ 6 HÀNG TUẦN
Bộ Tinh Ti: Nguyên Khởi,"['CN Animation', 'Kiếm hiệp', 'Huyền ảo']","['5.5', '45']",Hoàn thành,18,2024,"Hai thiếu niên dưới cái bóng của gia đình quý tộc khao khát vùng đất thần tiên huyền thoại Bồng Lai. Một sự kiện đặc biệt xảy ra đã đánh thức sức mạnh tiềm ẩn trong cơ thể họ, đồng thời đánh thức niềm khao khát chưa từng thấy của họ."
Thiếu Niên Ca Hành,"['CN Animation', 'Kiếm hiệp', 'Huyền ảo', 'Võ hiệp']","['8.7', '823']",Đang tiến hành,87,2018,PHIM ĐƯỢC CẬP NHẬT 1 TẬP MỖI TRƯA THỨ 4 HÀNG TUẦN
Vương Giả Vinh Diệu: Vinh Diệu chi Chương,"['CN Animation', 'Kiếm hiệp', 'Huyền ảo', 'Võ hiệp']","['8.7', '90']",Hoàn thành,4,2024,Vương Giả Vinh Diệu: Vinh Diệu chi Chương
Họa Giang Hồ Chi Thiên Cang,"['CN Animation', 'Kiếm hiệp', 'Võ hiệp']","['9.8', '347']",Hoàn thành,1,2023,N/A
Ám Hà Truyện,"['CN Animation', 'Kiếm hiệp', 'Võ hiệp']","['8.8', '108']",Hoàn thành,12,2023,PHIM ĐƯỢC CẬP NHẬT 1 TẬP MỖI TRƯA THỨ 4 HÀNG TUẦN
Tiêu Nhân,"['CN Animation', 'Kiếm hiệp', 'Võ hiệp']","['9.1', '176']",Hoàn thành,15,2023,“Tiêu Nhân” hay còn gọi là “Tiêu Sư” hoặc “Bảo Tiêu” chuyên hộ tống khách buôn cùng hàng hoá. 
Kiếm Vực Phong Vân,"['CN Animation', 'Kiếm hiệp', 'Huyền ảo']","['7.5', '262']",Hoàn thành,92,2022, 
Đan Đạo Tông Sư,"['CN Animation', 'Kiếm hiệp', 'Huyền ảo']","['5.8', '122']",Đang tiến hành,40,2023,PHIM ĐƯỢC CẬP NHẬT MỖI THỨ 2 VÀ THỨ 3 HÀNG TUẦN
Họa Giang Hồ chi Bất Lương Nhân Phần 6,"['CN Animation', 'Kiếm hiệp', 'Võ hiệp']","['8.6', '843']",Hoàn thành,12,2023,"Giám quốc lật đổ triều chính, đội quân Mạc Bắc tiến đánh Kỳ quốc, Kỳ quốc rơi vào tình cảnh ngàn cân treo sợi tóc. Và màn tái xuất đầy ngoạn mục của thiên tử Lý Tinh Vân."
Cửu Châu Phiêu Miểu Lục,"['CN Animation', 'Kiếm hiệp']","['7.5', '136']",Đang tiến hành,15,2023, 
Vạn Cổ Kiếm Thần 3D,"['Tiên hiệp', 'Kiếm hiệp', 'Huyền ảo', 'Võ hiệp', 'Khoa huyễn', 'CN Animation']","['6.4', '154']",Đang tiến hành,26,2022,PHIM ĐƯỢC CẬP NHẬT 1 TẬP MỖI THỨ 6 HÀNG TUẦN
Tuyệt Đại Song Kiều,"['Tiên hiệp', 'Kiếm hiệp', 'Huyền ảo', 'Võ hiệp', 'CN Animation']","['7.8', '163']",Đang tiến hành,18,2022, 
Tinh Võ Thần Quyết,"['CN Animation', 'Kiếm hiệp', 'Huyền ảo']","['6.8', '126']",Đang tiến hành,80,2021,PHIM ĐƯỢC CẬP NHẬT MỖI THỨ 3 VÀ THỨ 6 HÀNG TUẦN
Kiếm Đạo Đệ Nhất Tiên,"['CN Animation', 'Tiên hiệp', 'Kiếm hiệp', 'Trùng sinh']","['6.9', '147']",Hoàn thành,20,2022, 
Tầm Kiếm,"['Tiên hiệp', 'CN Animation', 'Kiếm hiệp', '[CNA] Hài hước']","['6.0', '105']",Đang tiến hành,12,2022,PHIM ĐƯỢC CẬP NHẬT 1 TẬP MỖI THỨ 3 HÀNG TUẦN
Tuyết Ưng Lĩnh Chủ Phần 3,"['CN Animation', 'Tiên hiệp', 'Kiếm hiệp', 'Huyền ảo']","['7.4', '397']",Đang tiến hành,26,2021,PHIM ĐƯỢC CẬP NHẬT 1 TẬP MỖI THỨ 2 HÀNG TUẦN
Đắc Ý Nhất Nhân Gian,"['CN Animation', 'Kiếm hiệp', 'Huyền ảo']","['8.4', '200']",Đang tiến hành,60,2021,PHIM ĐƯỢC CẬP NHẬT 2 TẬP MỖI THỨ 4 HÀNG TUẦN
Hồi Minh: Phong Hỏa Tam Nguyệt,"['CN Animation', 'Xuyên không', 'Huyền ảo']","['8.0', '128']",Đang tiến hành,13,2024,N/A
"Tensei shitara Dainana Ouji Datta node, Kimama ni Majutsu wo Kiwamemasu","['Anime', 'Hài hước', 'Phiêu lưu', 'Xuyên không']","['7.2', '410']",Hoàn thành,12,2024,"""Dòng dõi"", ""năng khiếu"" và ""sự nỗ lực"", đó là những điều cần thiết để học phép thuật. Một pháp sư bình thường rất yêu phép thuật nhưng lại không ban cho dòng dõi và năng khiếu đã gặp một kết cục bi thảm. Khi cận kề cái chết, cậu có một khao khát mãnh liệt là có thể được học phép thuật nhiều hơn để hoàn thiện nó. Sau khi tỉnh dậy, cậu nhất ra mình đã chuyển sinh thành Lloyd, đệ thất hoàng tử của vương quốc Saloum, đồng thời là dòng dõi pháp sư mạnh mẽ. Được chuyển sinh cùng với ký ức và kỹ năng của tiền kiếp, nay lại ở trong một dòng dõi hoàn hảo, cậu tận hưởng một cuộc sống vô tư để hoàn thiện phép thuật của mình với lượng ma lực dư thừa. Bộ truyện tranh được dựa trên Light Novel và được xuất bản trên App Manga của Kodansha, ""Magazine Pocket"", và trở thành tác phẩm được bán nhiều nhất trong App với hơn 3 triệu bản. Bộ truyện tranh chuyển sinh nổi tiếng này nay đã được chuyển thể thành Anime. Câu chuyện lấy bối cảnh tại một thế giới khác nơi có quái vật và quỷ. Nhân vật chính là Lloyd sở hữu lượng ma lực khổng lồ mà bất cứ ai cũng phải nể sợ. Chúng ta sẽ dõi theo hành trình phát triển không ngừng của cậu trong việc học phép thuật và cố gắng hoàn thiện nó. Câu chuyện chuyển sinh của đệ thất hoàng tử với những trận chiến phép thuật đầy phấn khích và ấn tượng đã bắt đầu."
Nghịch Thiên Tà Thần,"['CN Animation', 'Xuyên không', 'Huyền ảo']","['8.7', '360']",Hoàn thành,30,2023, 
Kage no Jitsuryokusha ni Naritakute! 2nd Season,"['Anime', 'Hành động', 'Hài hước', 'Giả tưởng', 'Xuyên không', 'Dị giới']","['9.6', '741']",Hoàn thành,12,2023,Phần thứ 2 của Chúa Tể Bóng Tối
Người Đại Diện Thời Gian 2,"['Drama', 'Siêu nhiên', 'CN Animation', 'Xuyên không']","['8.3', '48']",Hoàn thành,12,2023,Tiếp nối diễn biến của phần 1
Người Đại Diện Thời Gian,"['Drama', 'CN Animation', 'Xuyên không', '[CNA] Hài hước']","['8.1', '33']",Hoàn thành,12,2021,N/A
Ta Nhặt Được Thuộc Tính Đầy Đất,"['CN Animation', 'Tiên hiệp', 'Huyền ảo', '[CNA] Hài hước', 'Xuyên không']","['7.7', '145']",Đang tiến hành,16,2023,PHIM ĐƯỢC CẬP NHẬT 1 TẬP MỖI THỨ 2 HÀNG TUẦN
Thế Giới Vô Hạn,"['CN Animation', 'Xuyên không', 'Huyền ảo', 'Dị giới']","['8.7', '214']",Hoàn thành,16,2022, 
Trường Dạ Khai Thác Giả,"['CN Animation', 'Xuyên không', 'Huyền ảo', 'Dị giới']","['6.8', '156']",Hoàn thành,16,2022, 
Vạn Giới Thần Chủ,"['CN Animation', 'Tiên hiệp', 'Xuyên không', 'Huyền ảo']","['7.6', '650']",Đang tiến hành,296,2019,PHIM ĐƯỢC CẬP NHẬT MỖI THỨ 4 VÀ THỨ 7 HÀNG TUẦN
Thần Cấp Long Vệ,"['CN Animation', 'Xuyên không', 'Huyền ảo', 'Dị giới']","['6.1', '171']",Hoàn thành,26,2022, 
Nguyên Long (Phần 2),"['CN Animation', 'Tiên hiệp', 'Xuyên không', '[CNA] Ngôn tình', 'Dị giới']","['7.5', '143']",Hoàn thành,16,2021,Main: Vương Thắng
Nguyên Long (Phần 1),"['CN Animation', 'Tiên hiệp', 'Xuyên không', 'Trùng sinh', 'Huyền ảo', 'Dị giới']","['7.8', '133']",Hoàn thành,16,2020,Main: Vương Thắng
Thủ Tịch Ngự Linh Sư,"['CN Animation', 'Tiên hiệp', 'Xuyên không', 'Huyền ảo', '[CNA] Ngôn tình', 'Dị giới']","['7.0', '166']",Hoàn thành,100,2020,PHIM ĐƯỢC CẬP NHẬT MỖI THỨ 4 VÀ THỨ 7 HÀNG TUẦN
Manh Thê Thực Thần,"['CN Animation', 'Xuyên không']","['8.4', '266']",Hoàn thành,12,2018,"Diệp Giai Dao là người của thế giới hiện đại, là một biên tập viên mĩ thực xuất thân từ dòng giỏi đầu bếp . Thế mà lại xuyên vào thân thể của trưởng nữ Diệp Bình Hoài-Diệp Cẩn Hiên, tại Dương Châu, năm Hoài Tống."
Đấu Phá Thương Khung Bản Đặc Biệt ,"['Xuyên không', 'CN Animation', 'Huyền ảo', 'Dị giới']","['9.4', '513']",Hoàn thành,2,2017,Đấu Phá Thương Khung OVA1: lần đầu Tiêu Viêm gặp Vận Vận
