title,genre,rating,status,episodes,release year,description
Fairy Tail: 100 Years Quest,"['Anime', 'Hành động', 'Giả tưởng', 'Phiêu lưu']","['9.2', '228']",Đang tiến hành,13,2024,N/A
Wistoria: Wand and Sword,"['Anime', 'Hành động', 'Học đường', 'Siêu nhiên', 'Phiêu lưu']","['8.6', '263']",Đang tiến hành,12,2024,N/A
One Piece,"['Anime', 'Hành động', 'Hài hước', 'Phiêu lưu', 'Shounen', 'Drama']","['9.0', '16363']",Đang tiến hành,1131,1999,"Monkey D. Luffy, 1 cậu bé rất thích Đảo hải tặc có ước mơ tìm được kho báu One Piece và trở thành Vua hải tặc - Pirate King. Lúc nhỏ, Luffy tình cờ ăn phải trái quỉ (Devil Fruit) Gomu Gomu, nó cho cơ thể cậu khả năng co dãn đàn hồi như cao su nhưng đổi lại cậu sẽ không bao giờ biết bơi. Sau đó Luffy lại được Shank cứu thoát tuy nhiên ông ta bị mất 1 cánh tay. Sau đấy Shank chia tay Luffy và để lại cho cậu cái mũ rơm (Straw Hat) và nói rằng: Sau này bao giờ thành cướp biển hãy gặp ta và trả lại nó. Chính lời nói này đã thúc đầy Luffy trở thành 1 cướp biển thật sự."
The Elusive Samurai,"['Anime', 'Hành động', 'Lịch sử', 'Drama', 'Phiêu lưu', 'Samurai']","['8.0', '77']",Hoàn thành,13,2024,"Lấy bối cảnh ở Nhật Bản thời phong kiến ​​giữa thời kỳ Kamakura và Muromachi, anh hùng Hojo Takatoki của chúng ta là một cậu bé đang chạy trốn mà lịch sử đã quên lãng! Khi Mạc phủ Kamakura bị lật đổ bởi Ashikaga Takauji, gia đình và địa vị của Takatoki rõ ràng đã bị lấy đi khỏi anh ta, và anh ta phải chạy trốn đến những vùng đất xa xôi để sống sót và tìm cách trả thù!"
Koi wa Futago de Warikirenai,"['Anime', 'Hài hước', 'Tình cảm']","['6.6', '42']",Hoàn thành,12,2024,"Jun Shirasaki và chị em Jinguuji là bạn thời thơ ấu và là hàng xóm. Khi bạn gái đầu tiên của Jun, chị gái Ryuumi, chia tay anh, cô ấy đã nói điều gì đó khiến mối quan hệ của ba người, mối tình đầu và mối tình lãng mạn của họ trở nên phức tạp—?"
Atri: My Dear Moments,"['Anime', 'Tình cảm', 'Drama']","['7.7', '44']",Hoàn thành,12,2024,"Một phần của nền văn minh loài người đã bị nuốt chửng bởi sự dâng cao bất thường của mực nước biển, nguyên nhân vẫn chưa được làm sáng tỏ. Ikaruga Natsuki, cậu bé mồ côi mẹ và mất một chân trong tai nạn, trở về quê nhà sau nhiều năm sống khổ cực tại thành phố lớn. Tuy nhiên, khi về đến nơi, tất cả những gì cậu thấy chỉ là căn nhà cũ đã bị ngập dưới nước. Cậu không còn ai thân thuộc, chỉ có chiếc tàu và tàu ngầm do bà để lại, cùng với một khoản nợ lớn phải trả. Cơ hội duy nhất để Natsuki lấy lại ước mơ về tương lai là nhận lời mời của"
Synonyms: Why Nobody Remembers My World?,"['Anime', 'Hành động', 'Siêu nhiên', 'Phiêu lưu']","['7.6', '89']",Hoàn thành,12,2024,"Sid - anh hùng đã dẫn dắt nhân loại chiến thắng trong cuộc chiến tranh giành quyền bá chủ Trái Đất, bỗng nhiên thấy mình bị xóa sổ khỏi lịch sử. Thế giới thay đổi, con người thất bại trước rồng và ác quỷ, và Sid trở thành kẻ vô danh. Kai là một cậu bé bí ẩn miễn nhiễm với sự thay đổi này, cũng là người duy nhất nhớ về Sid. Cùng Rinne, một cô gái bí ẩn, Kai quyết tâm khôi phục ký ức cho thế giới và đưa Sid trở lại vị trí anh hùng."
Tensui no Sakuna-hime,"['Anime', 'Hành động', 'Siêu nhiên']","['5.1', '26']",Hoàn thành,13,2024,"Nữ thần thu hoạch hư hỏng Sakuna thấy mình bị trục xuất khỏi thiên đường sang trọng của mình đến một hòn đảo tràn ngập ma quỷ. Ở vùng hoang dã hoang sơ, cô phải tìm lại quyền sinh ra của mình là con gái của một vị thần chiến binh và nữ thần thu hoạch bằng cách vượt qua các yếu tố, chiến đấu với quái vật và trồng lúa, nguồn sức mạnh của cô. Bên cạnh cô ở nơi cấm địa này là Tama, người giám hộ của cô và một nhóm người bị ruồng bỏ. Cùng nhau, những người bạn đồng hành không ngờ tới này phải chung tay để chế ngự cả vùng đất và lũ quỷ trên Đảo Hinoe."
Boku no Hero Academia 7th Season,"['Anime', 'Hành động', 'Học đường', 'Siêu năng lực', 'Shounen']","['8.9', '185']",Đang tiến hành,19,2024,N/A
2.5-jigen no Ririsa,"['Anime', 'Hài hước', 'Harem', 'Học đường', 'Đời thường', 'Ecchi']","['8.4', '100']",Đang tiến hành,13,2024,"Okumura, một cậu nam sinh cấp ba bị mẹ bỏ, bị bạn bè trong trường bắt nạt, bị crush phũ, dẫn đến cậu thành một otaku căm ghét gái 3D. Trong đầu cậu, chỉ có gái 2D là nhất. Có điều, đó là trước khi cậu gặp Ririsa, một nữ otaku có niềm đam mê với cosplay. Sau khi nhìn thấy waifu của mình hiện thân ngoài đời, Okumura chợt ngộ ra ""gái 2.5D"" là một thuật ngữ có thật."
Quality Assurance in Another World,"['Anime', 'Hành động', 'Siêu nhiên', 'Phiêu lưu', 'Viễn tưởng']","['6.8', '52']",Hoàn thành,13,2024,"Nikola chỉ là một cô gái bình thường làm việc tại quán trọ cho đến ngày lũ rồng xâm chiếm, cô gặp và được cứu bởi Haga, một người có sứ mệnh nghiên cứu gì đó. Tuy vậy thứ mà cô không biết chính là Nikola chỉ là NPC trong một tựa game mà Haga có nhiệm vụ làm QA (chơi thử để tìm bug, lỗi) và thế là vô số tình huống dở khóc dở cười diễn ra sau đó."
Pokémon Horizons: The Series,"['Anime', 'Hành động', 'Hài hước', 'Phiêu lưu']","['5.3', '202']",Đang tiến hành,67,2023,"Tạm biệt Satoshi (Ask Ketchum) và Một Series mới bắt đầu với Liko và Roy khi họ làm sáng tỏ những bí ẩn xung quanh họ và chạm trán với Friede, Đội trưởng Pikachu, Amethio và những người khác trong cuộc phiêu lưu thú vị của họ!"
Tensei shitara Slime Datta Ken 3rd Season,"['Anime', 'Hành động', 'Hài hước', 'Giả tưởng', 'Shounen', 'Phiêu lưu']","['8.9', '482']",Đang tiến hành,25,2024,N/A
NieR:Automata Ver1.1a,"['Anime', 'Hành động', 'Giả tưởng', 'Viễn tưởng']","['8.2', '194']",Đang tiến hành,24,2023,"Bộ phim kể về câu chuyện của các android 2B, 9S và A2 trong cuộc chiến chống lại sự tàn phá của những cỗ máy mạnh mẽ. Nhân loại đã bị đẩy ra khỏi Trái Đất bởi những sinh vật máy móc từ thế giới khác. Trong nỗ lực cuối cùng để cứu lấy hành tinh này, con người đã tạo ra một lực lượng lính android để tiêu diệt những kẻ xâm lược. Giờ đây, một cuộc chiến giữa máy móc và người máy đang diễn ra ác liệt..."
Hazure Waku no [Joutai Ijou Skill] de Saikyou ni Natta Ore ga Subete wo Juurin Suru made,"['Anime', 'Hành động', 'Drama', 'Siêu nhiên', 'Phiêu lưu']","['8.3', '235']",Hoàn thành,12,2024,"Mikumo Touka, một học sinh trung học không nổi bật, bị triệu hồi đến thế giới khác cùng với các bạn cùng lớp để trở thành dũng sĩ. Trong khi các bạn được nữ thần Vicius xếp vào hạng S và A, Touka bị xếp hạng E và trở thành đối tượng bị “vứt bỏ”. Bị đưa đến di tích nơi không ai sống sót, Touka cố gắng thoát ra bằng cách sử dụng kỹ năng trạng thái bất thường bị coi thường. Từ ngày đó, ngọn lửa phục thù nữ thần Vicius bùng cháy trong cậu và cậu bắt đầu bộc lộ bản chất thực sự ẩn giấu bên trong. Hãy bắt đầu cuộc cạnh tranh sinh tồn nào…"
Tasuuketsu,"['Anime', 'Hành động', 'Drama']","['3.2', '33']",Đang tiến hành,11,2024,N/A
Katsute Mahou Shoujo to Aku wa Tekitai Shiteita,"['Anime', 'Tình cảm', 'Siêu nhiên']","['8.3', '71']",Hoàn thành,12,2024,"Câu chuyện về Mira, một anh zai lãnh đạo một tổ chức tà ác với mục tiêu chiếm lấy thế giới. Nhưng đời ai biết được chữ ngờ, ổng gặp một ma pháp thiếu nữ tên là Byakuya Mimori rồi tình cờ yêu ẻm luôn. Romcom học đường thì cũng hay đấy? Thế romcom fantasy thì sao, cùng đón xem nhé!"
Isekai Shikkaku,"['Anime', 'Hành động', 'Hài hước', 'Phiêu lưu']","['8.3', '123']",Hoàn thành,12,2024,"Một cuộc phiêu lưu ở một thế giới khác với những cô gái dễ thương bên cạnh bạn và sức mạnh giống như trò chơi điện tử—nghe giống như giấc mơ của một người hâm mộ anime, phải không? Đối với tác giả u sầu Osamu Dazai thì không như vậy, người thực sự thích chết đi. Trò chơi điện tử thậm chí còn chưa được phát minh khi anh ta bị kéo vào một thế giới khác vào năm 1948. Thực sự, tất cả những cuộc phiêu lưu kỳ ảo mà anh ta tiếp tục tham gia chỉ cản trở giấc mơ thơ mộng của anh ta là tìm được một nơi hoàn hảo để chết. Nhưng cho dù anh ta có mạo hiểm đến mức nào đi chăng nữa, mọi thứ dường như vẫn diễn ra ổn thỏa. Theo chân một anh hùng khốn khổ không giống ai trong bộ phim hài isekai vui vẻ ảm đạm này!"
Hitoribocchi no Isekai Kouryaku,"['Anime', 'Hành động', 'Hài hước', 'Tình cảm', 'Harem', 'Xuyên không', 'Ecchi']","['8.7', '37']",Đang tiến hành,1,2024,N/A
"""Oshi no Ko"" 2nd Season","['Anime', 'Drama', 'Seinen', 'Siêu nhiên']","['7.8', '172']",Đang tiến hành,12,2024,N/A
Ookami to Koushinryou: merchant meets the wise wolf,"['Anime', 'Tình cảm', 'Giả tưởng', 'Lịch sử', 'Phiêu lưu']","['8.3', '101']",Đang tiến hành,25,2024,"Sói Và Gia Vị (Spice and Wolf) 2024 là bản làm lại của bộ anime nổi tiếng Ookami to Koushinryou Cuộc sống du lịch của Kraft Lawrence là một cuộc hành trình đơn độc, đi từ thị trấn này đến thị trấn khác chỉ cùng chiếc xe ngựa và hàng hóa. Nhưng mọi thay đổi khi anh phát hiện một nữ thần sói, Holo, đang ẩn nấp trong xe của mình. Holo, trong hình dạng của một cô gái xinh đẹp với tai và đuôi sói, muốn đổi sự giúp đỡ của mình để tăng lợi nhuận cho Lawrence trong trao đổi là được đi cùng anh trong các chuyến du lịch. Lawrence không thể từ chối đề xuất này, nhưng sớm nhận ra rằng việc có một nữ thần cổ đại làm bạn đồng hành có thể mang lại cả mặt tích cực lẫn tiêu cực. Liệu Holo có thể được thuần hóa và hoà nhập vào cuộc sống du lịch của Lawrence không?"
Na Nare Hana Nare,"['Anime', 'Thể thao']","['5.2', '19']",Đang tiến hành,11,2024,N/A
Kinnikuman Perfect Origin Arc,"['Anime', 'Hài hước', 'Thể thao']","['3.0', '32']",Đang tiến hành,12,2024,N/A
The Fable,"['Anime', 'Hài hước', 'Seinen']","['6.9', '36']",Đang tiến hành,24,2024,N/A
Mission: Yozakura Family,"['Anime', 'Hành động', 'Hài hước', 'Tình cảm', 'Siêu năng lực']","['8.4', '149']",Đang tiến hành,25,2024,"Nam sinh trung học Asano Taiyou sau khi mất đi gia đình mình trong một cuộc tai nạn thảm khốc đã trở nên hướng nội và khép kín với tất cả mọi người trừ cô bạn thuở nhỏ Yozakura Mutsumi. Tưởng chừng cuộc sống cậu không thể tồi tệ hơn nữa, nhưng bỗng một ngày tính mạng của Taiyou lại bị đe dọa bởi ông anh trai yêu em gái quá mức của Mutsumi. Cách duy nhất để cậu bảo vệ cho chính mình lẫn Mutsumi là cưới cô ấy và gia nhập gia tộc điệp viên Yozakura đứng hàng đầu trong thế giới ngầm."
Monogatari Series: Off & Monster Season,"['Anime', 'Hài hước', 'Bí ẩn', 'Siêu nhiên', 'Ma cà rồng']","['7.8', '29']",Đang tiến hành,11,2024,N/A
Shy,"['Anime', 'Hành động', 'Siêu năng lực', 'Drama']","['5.2', '72']",Đang tiến hành,24,2023,"Vào giữa thế kỷ 21, chiến tranh đã biến mất khỏi trái đất. Thế rồi đột nhiên, những con người có sức mạnh siêu phàm, được gọi là """"anh hùng"""", đã đồng loạt xuất hiện tại nhiều quốc gia khác nhau, khiến công cuộc tìm kiếm hòa bình có những thay đổi đáng kể. Trong một thế giới mà những anh hùng từ các quốc gia khác nhau làm việc để duy trì nền hòa bình mới tìm được, người chịu trách nhiệm cho hòa bình của Nhật Bản là một nữ anh hùng rụt rè, rất ngại xuất hiện trước công chúng, tên là SHY."
Midnight Punch,"['Anime', 'Hài hước', 'Đời thường']","['5.9', '40']",Đang tiến hành,12,2024,"Masakichi, cựu thành viên của nhóm NewTuber nổi tiếng Harikiri Sisters. Sau một bước lùi trong sự nghiệp, cụ thể là bị sa thải bất ngờ ngay trên sóng trực tiếp. Với nỗ lực quay trở lại, cô ấy hợp tác với Live. Cùng nhau, họ bắt tay vào công cuộc lập kênh mới với quyết tâm tạo ra những nội dung gây sốt và đạt mốc 1 triệu người đăng ký trên NewTube. Liệu họ có thể chạm tới ước mơ nội dung của mình hay sẽ bị nhấn nút chặn?"
Tower of God Season 2,"['Anime', 'Hành động', 'Bí ẩn', 'Giả tưởng', 'Drama', 'Phiêu lưu']","['8.5', '151']",Đang tiến hành,12,2024,Phần 2 của Tower of God
Makeine: Too Many Losing Heroines!,"['Anime', 'Tình cảm', 'Học đường', 'Đời thường']","['8.7', '112']",Đang tiến hành,11,2024,"“Eh? Những nữ chính thua cuộc(Makein) là ai cơ?” Tôi- Nukumizu Kazuhiko, một nhân vật phụ trong lớp, đã chứng kiến cảnh tượng cô nàng nổi tiếng- Yanami Anna bị đá. ""Mặc dù cậu ấy đã nói sẽ cưới mình, cậu không thấy làm vậy là quá đáng sao?"" ""Chuyện đó, cậu ấy nói vậy khi nào thế?"" ""Lúc bọn mình 4, 5 tuổi gì đấy"" Chuyện đó không tính đúng không. Chính vào lúc đó, đã xuất hiện những nữ chính mang trên mình cảm giác ""thua cuộc"", như Yakishio Lemon của câu lạc bộ điền kinh, hay Komari Chika của câu lạc bộ văn họcー? ""Nukumizu-kun. Con gái được chia làm hai loại. Là bạn thuở nhỏ, và con mèo vụng trộm"" ""Thì ra là vậy, cách phân loại táo bạo nhỉ"" Vui lên nào, những cô gái tỏa sáng lấp lánh sau thua cuộc. Thời thanh xuân bí ẩn cùng với những Makein- những nữ chính thua cuộc, đã chính thức khai màn!"
"Shinmai Ossan Bouken-sha, Saikyou Party ni Shinu Hodo Kitaerarete Muteki ni Naru","['Hành động', 'Hài hước', 'Phiêu lưu']","['7.7', '156']",Đang tiến hành,12,2024,N/A
Strike the Blood V,"['Anime', 'Hành động', 'Hài hước', 'Tình cảm', 'Harem', 'Học đường', 'Siêu nhiên', 'Ma cà rồng']","['8.4', '127']",Hoàn thành,4,2022,Phần cuối của series Strike the Blood.
Sengoku Youko,"['Anime', 'Hành động', 'Giả tưởng', 'Shounen', 'Drama', 'Siêu nhiên', 'Phiêu lưu']","['7.2', '83']",Đang tiến hành,24,2024,"Thế giới được chia thành hai phe: con người và quái vật gọi là katawara. Mặc dù là một katawara, Tama yêu thương con người và tuyên thệ bảo vệ họ khỏi ác, ngay cả khi đó có nghĩa là phải chiến đấu với loài của mình. Trong khi đó, anh trai của Tama, Jinka, lại ghét con người, mặc dù phần lớn anh cũng là một người. Hai người anh em này được kết hợp với một kiếm sĩ hèn nhát tên là Shinsuke, người muốn học cách trở nên mạnh mẽ."
Ore wa Subete wo [Parry] Suru: Gyaku Kanchigai no Sekai Saikyou wa Boukensha ni Naritai,"['Anime', 'Hành động', 'Siêu nhiên', 'Phiêu lưu']","['8.3', '208']",Đang tiến hành,12,2024,N/A
Isekai Yururi Kikou: Kosodate Shinagara Boukensha Shimasu,"['Anime', 'Hành động', 'Hài hước', 'Phiêu lưu', 'Dị giới']","['7.3', '100']",Đang tiến hành,12,2024,N/A
Mob kara Hajimaru Tansaku Eiyuutan,"['Anime', 'Hành động', 'Harem', 'Siêu nhiên', 'Phiêu lưu']","['7.4', '124']",Đang tiến hành,12,2024,"Takagi Kaito là một học sinh và là nhà thám hiểm bình thường. Ngày nọ, cậu nhận được vật phẩm siêu hiếm sau khi đánh bại con slime lạ chưa từng xuất hiện trước đây tại hầm ngục, vật phẩm cho phép cậu triệu hồi một loli với sức mạnh vô song. Hành trình leo rank của nhà thám hiểm bình thường bắt đầu..."
Maou Gun Saikyou No Majutsushi Wa Ningen Datta,"['Anime', 'Hành động', 'Siêu nhiên', 'Xuyên không']","['7.2', '130']",Hoàn thành,12,2024,Ẩn thân dưới cái áo choàng và mặt nạ làm một bí mật có thể dẫn đến cái chết của chủ nhân nó.
Kengan Ashura 3nd Season,"['Anime', 'Hành động', 'Võ thuật']","['8.3', '52']",Hoàn thành,28,2023,"Vòng 2 của Giải đấu Sinh tử Kengan tiếp tục mà không có Ohma. Khi các đấu sĩ hùng mạnh đụng độ nhau, một nhân vật mờ ám âm mưu màn nổi loạn bạo lực."
Kim Ngô Vệ,"['Hành động', 'Thám tử', 'CN Animation', 'Huyền ảo']","['6.1', '46']",Hoàn thành,16,2024,"Lôi hỏa chết người, lời đồn lan rộng, âm binh mặt chuột hoành hành đế đô, tất cả dường như đều hướng đến bí mật của tiền triều đã bị lôi hỏa hủy diệt. "
Suicide Squad ISEKAI,"['Anime', 'Hành động', 'Xuyên không']","['8.1', '80']",Đang tiến hành,10,2024,N/A
SPY×FAMILY CODE: White,"['Anime', 'Hành động', 'Hài hước', 'Đời thường']","['9.4', '61']",Hoàn thành,1,2024,N/A
"Bye Bye, Earth","['Anime', 'Hành động', 'Giả tưởng', 'Phiêu lưu']","['5.6', '16']",Đang tiến hành,1,2024,N/A
VTuber Legend: How I Went Viral after Forgetting to Turn Off My Stream,"['Anime', 'Hài hước', 'Tình cảm', 'Giả tưởng', 'Đời thường']","['6.7', '50']",Đang tiến hành,12,2024,N/A
Shikanoko Nokonoko Koshitantan,"['Anime', 'Hài hước', 'Học đường']","['8.4', '125']",Đang tiến hành,12,2024,"Không ai biết về bí mật của Torako - rằng cô từng là người từng một thời làm giang hồ. Đối với các bạn cùng lớp, thì cô ấy là một nữ sinh hoàn hảo. Nhưng cuộc sống học đường của Torako dần bị xáo trộn khi Nokotan, một nữ sinh chuyển trường với đôi gạc theo đúng nghĩa đen và có một khứu giác kỳ lạ, nên cô ấy có thể ""đánh hơi"" được quá khứ của Torako. Dù là trường học hay sở thú, thì Nokotan vẫn luôn là ""cô nai"" kỳ lạ, làm đảo lộn mọi nhận thức thông thường của Torako. Liệu Torako là một cô gái, hay là một con nai hoặc thậm chí là cả hai? Cùng đón xem nhé!"
Tokidoki Bosotto Russia-go de Dereru Tonari no Alya-san,"['Anime', 'Hài hước', 'Tình cảm', 'Học đường']","['9.2', '387']",Đang tiến hành,12,2024,"Tokidoki Bosotto Russia-go De Dereru Tonari No Alya-san kể về tình yêu giữa Masachika và Alisa Mikhailovna Kujou - người thường được gọi là Alya. Mặc dù lạnh lùng và khó gần, nhưng Alya lại thân thiện với Masachika - một trong số ít người hiểu được tiếng Nga của cô."
Ramen Akaneko,"['Anime', 'Hài hước', 'Shounen']","['7.0', '12']",Đang tiến hành,10,2024,N/A
Doraemon Movie 43 Nobita Và Bản Giao Hưởng Địa Cầu,"['Anime', 'Hài hước', 'Siêu nhiên', 'Phiêu lưu']","['8.9', '28']",Hoàn thành,1,2024,N/A
Henjin no Salad Bowl,"['Anime', 'Hài hước', 'Giả tưởng']","['7.6', '51']",Hoàn thành,12,2024,"Sousuke Kaburaya, một thám tử nghèo khó, gặp Sara, một công chúa đến từ thế giới khác với sức mạnh ma thuật. Họ bắt đầu sống cùng nhau và Sara nhanh chóng điều chỉnh cuộc sống của mình để phù hợp với Nhật Bản hiện đại."
Shinigami Bocchan to Kuro Maid 3rd Season,"['Anime', 'Hài hước', 'Tình cảm', 'Siêu nhiên']","['8.5', '83']",Hoàn thành,12,2024,Phần 3 của bộ phim Shinigami Bocchan to Kuro Maid
Lv2 kara Cheat datta Motoyuusha Kouho no Mattari Isekai Life,"['Anime', 'Hành động', 'Hài hước', 'Tình cảm', 'Giả tưởng', 'Phiêu lưu']","['8.2', '230']",Hoàn thành,12,2024,"Banaza là một thương nhân luôn chăm chỉ làm việc mỗi ngày đã bị đột nhiên triệu hồi tới Vương Quốc Ma Pháp Klyrode xa lạ làm ứng viên dũng sĩ. Tuy nhiên, anh đã bị đánh trượt vì chỉ có cấp độ 1 giống như dân thường. Không những vậy, anh còn không thể trở về vì sai lầm của chính quyền... Banza đã rời vương đô để tới vùng biên cảnh và phải chiến đấu với slime để giữ mạng. Thế rồi, câu chuyện có bước chuyển biến lớn sau khi anh thay đổi hình dáng và tên họ. Một ma thú đã phải lòng anh đi tới hôn nhân. Thế là họ cùng nhau hướng tới một cuộc sống thảnh thơi, không phân biệt chủng tộc!"
Shuumatsu Train Doko E Iku,"['Anime', 'Hài hước', 'Đời thường', 'Phiêu lưu', 'Viễn tưởng']","['6.7', '64']",Hoàn thành,12,2024,"Câu chuyện của anime diễn ra tại một thị trấn nông thôn bí ẩn, nơi xảy ra những sự kiện kỳ lạ. Shizuru Chikura, một cô gái trẻ, đang tìm kiếm người bạn mất tích của mình. Cô cùng ba người bạn lên một chuyến tàu bí ẩn, bắt đầu cuộc hành trình ra thế giới bên ngoài, nơi sự sống còn trở nên khó khăn. Họ sẽ phải đối mặt với những thử thách gì ở điểm đến cuối cùng của ""Chuyến tàu ngày tận thế""?"
Tsuki ga Michibiku Isekai Douchuu 2nd Season,"['Anime', 'Hành động', 'Hài hước', 'Giả tưởng', 'Phiêu lưu', 'Xuyên không']","['9.0', '560']",Hoàn thành,25,2024,Phần 2 của bộ phim Tsuki ga Michibiku Isekai Douchuu
Yoru no Kurage wa Oyogenai,"['Anime', 'Hài hước', 'Đời thường']","['7.5', '65']",Hoàn thành,12,2024,"""Mình"" cũng muốn tỏa sáng như ai đó. Điện thoại thông minh sẽ luôn chỉ cho chúng ta biết chủ đề nên nói của ngày mai, trang phục nên mua trong tuần. Thế giới này luôn bận rộn đến mức, ta chẳng có thời gian để mơ biến thành một con người khác. Umituki Yoru, một họa sĩ minh họa đang dừng hoạt động. Tachibana Nonoka, một cựu Idol đang muốn đi hát trở lại. Ryuugasaki, Vtuber mạnh nhất tự phong. Kimura-chan, một người soạn nhạc bí ẩn muốn hỗ trợ Oshi của mình. Bốn cô gái có chút lạc lõng với thế giới, đã tạo thành một nhóm nghệ sĩ ẩn danh lấy tên là JELEE. Nếu ""chúng ta"" không phải chính mình, biết đâu sẽ có thể tỏa sáng."
"Maou No Ore Ga Dorei Elf Wo Yome Ni Shitanda Ga, Dou Medereba Ii?","['Anime', 'Hành động', 'Hài hước', 'Tình cảm']","['8.7', '255']",Hoàn thành,12,2024,"Zagan bị kinh sợ bởi hắn là một hắc pháp sư, hắn nguy hiểm và nói năng cục cằn và một lần nữa cho lũ trộm xâm nhập vào lãnh thổ của hắn ăn hành khi hắn đang dở nghiên cứu lúc sáng nay. Trong buổi đấu giá ngầm, hắn trông thấy một em tinh linh nô lệ trắng, Nephie, thiếu nữ có nét đẹp tuyệt trần. Đổ ngay từ cái nhìn đầu tiên, hắn dồn hết của cải để mua cô, nhưng kĩ năng giao tiếp xã hội quá nát, hắn không biết cách để giao tiếp với cô. Và thế là cuộc sống chung vụng về của pháp sư không biết thổ lộ tình cảm của mình và bé nô lệ mong muốn thiết tha chủ nhân của mình nhưng không biết nói ra nó như thế nào, bắt đầu."
Astro Note,"['Anime', 'Hài hước', 'Tình cảm', 'Siêu nhiên']","['4.9', '43']",Hoàn thành,12,2024,"Takumi, một đầu bếp tài năng, vừa bị cho thôi việc. Anh ấy nhận được hợp đồng biểu diễn tại một khu nhà trọ cũ tên là Astro-sou nhưng do dự chấp nhận sau khi biết mình cũng phải sống ở đó toàn thời gian. Đó là cho đến khi anh gặp người chăm sóc xinh đẹp và quyến rũ, Mira, và anh bị bán. Cả hai bắt đầu làm việc cùng nhau và mối quan hệ của họ ngày càng sâu sắc. Nhưng Mira có một bí mật: cô ấy không đến từ thế giới này!"
Kono Subarashii Sekai ni Shukufuku wo! 3,"['Anime', 'Hài hước', 'Giả tưởng', 'Phiêu lưu', 'Dị giới']","['9.5', '287']",Hoàn thành,11,2024,Phần 3 của hành trình tấu tài ở dị giới
